{
  "schema_version": "experiment-run.v1",
  "run_id": "mock-dry-run-v1",
  "fixture_version": "annotation-bench-v1",
  "fixture_content_hash": "5d12219a3e540807",
  "taxonomy_version": "taxonomy-theme-device-v1-excl-time",
  "prompt_version": "zh-literary-rich-v1",
  "created_at": "2026-10-04T04:34:38.423Z",
  "research_only": true,
  "llm": {
    "adapter_id": "mock-llm",
    "model": "handcrafted-fixture-responses",
    "version": "dry-run"
  },
  "embedding": {
    "adapter_id": "mock",
    "version": "hash-ngram-v0",
    "notes": "Deterministic mock vectors for plumbing review only."
  },
  "pipeline": {
    "free_concepts_first": true,
    "active_dimensions": [
      "theme",
      "device"
    ],
    "reconcile_exclusions": [
      "theme:时间",
      "dimension:scene_time"
    ],
    "reconcile_threshold": null,
    "reject_is_blacklist": false
  },
  "results": [
    {
      "quote_id": 1,
      "group": "legacy_human_tagged",
      "annotation_interpretation": null,
      "free_concepts": [
        {
          "concept_text": "忧伤",
          "dimension": "theme",
          "generation_source": "llm_free",
          "run_id": "mock-dry-run-v1",
          "brief_rationale": "语气带着失落或隐痛。"
        },
        {
          "concept_text": "记忆",
          "dimension": "theme",
          "generation_source": "llm_free",
          "run_id": "mock-dry-run-v1",
          "brief_rationale": "叙述回望既往经验。"
        },
        {
          "concept_text": "孤独",
          "dimension": "theme",
          "generation_source": "llm_free",
          "run_id": "mock-dry-run-v1",
          "brief_rationale": "主体处在疏离情境中。"
        },
        {
          "concept_text": "时间流逝",
          "dimension": "theme",
          "generation_source": "llm_free",
          "run_id": "mock-dry-run-v1",
          "brief_rationale": "文本暗示时辰或岁月推移（不做成 Scene/Time 标签）。"
        },
        {
          "concept_text": "比喻",
          "dimension": "device",
          "generation_source": "llm_free",
          "run_id": "mock-dry-run-v1",
          "brief_rationale": "出现以一物喻另一物的表达，不自动等同于词表中的隐喻。"
        },
        {
          "concept_text": "意象",
          "dimension": "device",
          "generation_source": "llm_free",
          "run_id": "mock-dry-run-v1",
          "brief_rationale": "具体物象承载情绪。"
        }
      ],
      "proposed_outcomes": [
        {
          "concept_text": "忧伤",
          "dimension": "theme",
          "generation_source": "llm_free",
          "run_id": "mock-dry-run-v1",
          "reconciliation_candidates": [
            {
              "tag_id": 7,
              "tag_zh": "痛苦",
              "dimension": "theme",
              "similarity": 0.3068337153058843
            },
            {
              "tag_id": 9,
              "tag_zh": "记忆",
              "dimension": "theme",
              "similarity": 0.1463246151344114
            },
            {
              "tag_id": 18,
              "tag_zh": "轮回",
              "dimension": "theme",
              "similarity": 0.12790391521374594
            },
            {
              "tag_id": 8,
              "tag_zh": "寂静",
              "dimension": "theme",
              "similarity": 0.11404117533731388
            },
            {
              "tag_id": 11,
              "tag_zh": "衰败",
              "dimension": "theme",
              "similarity": 0.11269866554469805
            }
          ],
          "reconciliation_outcome": "new_personal_concept",
          "selected_canonical_tag": null,
          "retained_personal_concept": {
            "label": "忧伤",
            "dimension": "theme"
          }
        },
        {
          "concept_text": "记忆",
          "dimension": "theme",
          "generation_source": "llm_free",
          "run_id": "mock-dry-run-v1",
          "reconciliation_candidates": [
            {
              "tag_id": 9,
              "tag_zh": "记忆",
              "dimension": "theme",
              "similarity": 1.0000000000000002
            },
            {
              "tag_id": 8,
              "tag_zh": "寂静",
              "dimension": "theme",
              "similarity": 0.3667720220822181
            },
            {
              "tag_id": 10,
              "tag_zh": "焦虑",
              "dimension": "theme",
              "similarity": 0.23881576824054657
            },
            {
              "tag_id": 11,
              "tag_zh": "衰败",
              "dimension": "theme",
              "similarity": 0.11359105120488486
            },
            {
              "tag_id": 12,
              "tag_zh": "掌控",
              "dimension": "theme",
              "similarity": 0.10162614375378687
            }
          ],
          "reconciliation_outcome": "new_personal_concept",
          "selected_canonical_tag": null,
          "retained_personal_concept": {
            "label": "记忆",
            "dimension": "theme"
          }
        },
        {
          "concept_text": "孤独",
          "dimension": "theme",
          "generation_source": "llm_free",
          "run_id": "mock-dry-run-v1",
          "reconciliation_candidates": [
            {
              "tag_id": 7,
              "tag_zh": "痛苦",
              "dimension": "theme",
              "similarity": 0.13552072846262353
            },
            {
              "tag_id": 14,
              "tag_zh": "命运",
              "dimension": "theme",
              "similarity": 0.06470600067801267
            },
            {
              "tag_id": 16,
              "tag_zh": "末日",
              "dimension": "theme",
              "similarity": 0.05370166866386645
            },
            {
              "tag_id": 13,
              "tag_zh": "死亡",
              "dimension": "theme",
              "similarity": 0.05166348745633857
            },
            {
              "tag_id": 17,
              "tag_zh": "厌恶",
              "dimension": "theme",
              "similarity": 0.03682196355656485
            }
          ],
          "reconciliation_outcome": "new_personal_concept",
          "selected_canonical_tag": null,
          "retained_personal_concept": {
            "label": "孤独",
            "dimension": "theme"
          }
        },
        {
          "concept_text": "时间流逝",
          "dimension": "theme",
          "generation_source": "llm_free",
          "run_id": "mock-dry-run-v1",
          "reconciliation_candidates": [
            {
              "tag_id": 16,
              "tag_zh": "末日",
              "dimension": "theme",
              "similarity": 0.09548499026348643
            },
            {
              "tag_id": 13,
              "tag_zh": "死亡",
              "dimension": "theme",
              "similarity": 0.08952803739101223
            },
            {
              "tag_id": 7,
              "tag_zh": "痛苦",
              "dimension": "theme",
              "similarity": 0.03070896463304977
            },
            {
              "tag_id": 9,
              "tag_zh": "记忆",
              "dimension": "theme",
              "similarity": 0.009535622961902362
            },
            {
              "tag_id": 17,
              "tag_zh": "厌恶",
              "dimension": "theme",
              "similarity": -0.0014563209873607458
            }
          ],
          "reconciliation_outcome": "new_personal_concept",
          "selected_canonical_tag": null,
          "retained_personal_concept": {
            "label": "时间流逝",
            "dimension": "theme"
          }
        },
        {
          "concept_text": "比喻",
          "dimension": "device",
          "generation_source": "llm_free",
          "run_id": "mock-dry-run-v1",
          "reconciliation_candidates": [
            {
              "tag_id": 19,
              "tag_zh": "隐喻",
              "dimension": "device",
              "similarity": 0.2620968239798923
            },
            {
              "tag_id": 22,
              "tag_zh": "内涵",
              "dimension": "device",
              "similarity": 0.07349796789535855
            },
            {
              "tag_id": 21,
              "tag_zh": "头韵",
              "dimension": "device",
              "similarity": 0.039010885202209696
            },
            {
              "tag_id": 20,
              "tag_zh": "拟人",
              "dimension": "device",
              "similarity": 0.032103105282754146
            },
            {
              "tag_id": 24,
              "tag_zh": "外貌描写",
              "dimension": "device",
              "similarity": -0.01802557969839431
            }
          ],
          "reconciliation_outcome": "new_personal_concept",
          "selected_canonical_tag": null,
          "retained_personal_concept": {
            "label": "比喻",
            "dimension": "device"
          },
          "caution": "candidates_only_until_human_judges_appropriateness; do_not_assume_biyu_equals_yinyu"
        },
        {
          "concept_text": "意象",
          "dimension": "device",
          "generation_source": "llm_free",
          "run_id": "mock-dry-run-v1",
          "reconciliation_candidates": [
            {
              "tag_id": 23,
              "tag_zh": "意象",
              "dimension": "device",
              "similarity": 1.0000000000000002
            },
            {
              "tag_id": 26,
              "tag_zh": "长句描写",
              "dimension": "device",
              "similarity": 0.24360901249985145
            },
            {
              "tag_id": 28,
              "tag_zh": "心理描写",
              "dimension": "device",
              "similarity": 0.19987147048690188
            },
            {
              "tag_id": 19,
              "tag_zh": "隐喻",
              "dimension": "device",
              "similarity": 0.17001332513038964
            },
            {
              "tag_id": 22,
              "tag_zh": "内涵",
              "dimension": "device",
              "similarity": 0.13380412346085435
            }
          ],